{
  "run_id": "R1",
  "job": "intake_partner_feed",
  "trigger": "manual",
  "triggered_by": "user-2",
  "started_at": "2026-10-18T10:00:00Z",
  "ended_at": "2026-10-18T10:00:00Z",
  "outcome": "finished",
  "inputs_seen": 1000,
  "outcomes_by_type": {
    "VALIDATED": 900,
    "QUARANTINED": 100
  },
  "errors": [],
  "limit_reached": true,
  "batch_size": 1000,
  "backlog_remaining": 1500,
  "checkpoint": {
    "receipt_time": "2026-10-18T10:00:00Z",
    "raw_id": "r1000"
  },
  "config_version": "c1",
  "code_version": "v0.1"
}
